<?xml version="1.0" encoding="ISO-8859-1" ?>
<personas  xmlns:xsi="http://www.w3.org/2001/XMLSchema-instance"
 xsi:noNamespaceSchemaLocation="personas.xsd">
    <nombre>Juan Pardo</nombre>
    <nacimiento dia="10" mes="Abril" anyo="1982" />
    <direccion>
        <calle>caoba,1</calle>
        <poblacion>Madrid</poblacion>
        <provincia>Madrid</provincia>
        <cpostal>28005</cpostal>
    </direccion>
    <sexo>Varon</sexo>
</personas>